match_id,patch,league_name,radiant_name,dire_name,radiant_win,draft_order,draft_teams,draft_is_pick,radiant_players,dire_players
8821561885,60,Dota 2 Space League,Night Vision,FALL VICTIMS,False,"Rubick, Techies, Death Prophet, Batrider, Venomancer, Visage, Arc Warden, Ogre Magi, Shadow Fiend, Skywrath Mage, Snapfire, Magnus, Kez, Spirit Breaker, Axe, Nyx Assassin, Disruptor, Tinker, Warlock, Marci, Vengeful Spirit, Abaddon, Weaver, Wraith King","0, 0, 1, 1, 0, 1, 1, 0, 1, 0, 0, 1, 1, 0, 0, 1, 1, 0, 0, 1, 0, 1, 0, 1","False, False, False, False, False, False, False, True, True, False, False, False, True, True, True, True, True, True, False, False, False, False, True, True","NV.mintyfresh, NV.Volcanus, NV.popcorny, NV.Jupitera, NV.WaifuWarrior","FV.Norbert, FV.1Yato1, FV.BenzDance~, FV.Trilemma, FV.NoRemorse"
8821537936,60,Dota 2 Space League,FALL VICTIMS,Night Vision,False,"Abaddon, Arc Warden, Visage, Sand King, Bane, Nyx Assassin, Venomancer, Huskar, Ancient Apparition, Batrider, Death Prophet, Tinker, Skywrath Mage, Io, Hoodwink, Leshrac, Kez, Dawnbreaker, Windranger, Ring Master, Pugna, Nature's Prophet, Pangolier, Shadow Fiend","1, 1, 0, 0, 1, 0, 0, 1, 0, 1, 1, 0, 0, 1, 1, 0, 0, 1, 1, 0, 1, 0, 1, 0","False, False, False, False, False, False, False, True, True, False, False, False, True, True, True, True, True, True, False, False, False, False, True, True","FV.1Yato1, FV.Norbert, FV.BenzDance~, FV.Trilemma, FV.NoRemorse","NV.mintyfresh, NV.WaifuWarrior, NV.Volcanus, NV.popcorny, NV.Jupitera"
8821528515,60,Immigrant Night Club #1,,,True,"Outworld Devourer, Arc Warden, Nyx Assassin, Spirit Breaker, Ring Master, Axe, Silencer, Monkey King, Oracle, Huskar, Tinker, Dawnbreaker, Rubick, Shadow Shaman, Night Stalker, Chaos Knight, Lifestealer, Nature's Prophet, Meepo, Viper, Invoker, Storm Spirit, Faceless Void, Necrophos","1, 1, 0, 0, 1, 0, 0, 1, 0, 1, 1, 0, 0, 1, 1, 0, 0, 1, 1, 0, 1, 0, 1, 0","False, False, False, False, False, False, False, True, True, False, False, False, True, True, True, True, True, True, False, False, False, False, True, True","Sirclickalot,  1\/]un0 , shwe ba, Tha Ye1, Heinz","Oppa Power, Second Man, sweet winter, Demonice, Lu Yoke Mar"
8821516523,60,Dota 2 Space League,Vitality Warriors,FLYING FORTUNE,True,"Techies, Io, Abaddon, Arc Warden, Death Prophet, Bane, Batrider, Rubick, Lich, Tinker, Oracle, Beastmaster, Hoodwink, Doom, Void Spirit, Dragon Knight, Pangolier, Grimstroke, Silencer, Puck, Necrophos, Phantom Assassin, Luna, Terrorblade","0, 0, 1, 1, 0, 1, 1, 0, 1, 0, 0, 1, 1, 0, 0, 1, 1, 0, 0, 1, 0, 1, 0, 1","False, False, False, False, False, False, False, True, True, False, False, False, True, True, True, True, True, True, False, False, False, False, True, True","VW.Chucklesaur, VW.Laughalot, VW.Gigglebot, VW.Snickerdoodle, VW.Jesterface","Ff.Duh, Ff.WaitFreestyle, Ff.DaemonT, Ff.KoSide, Ff.ZagZag"
8821496443,60,Dota 2 Space League,FLYING FORTUNE,Vitality Warriors,False,"Brewmaster, Batrider, Bane, Arc Warden, Night Stalker, Abaddon, Dazzle, Disruptor, Sniper, Huskar, Dark Seer, Magnus, Crystal Maiden, Tusk, Ogre Magi, Pangolier, Nyx Assassin, Monkey King, Alchemist, Outworld Devourer, Bloodseeker, Puck, Faceless Void, Underlord","0, 0, 1, 1, 0, 1, 1, 0, 1, 0, 0, 1, 1, 0, 0, 1, 1, 0, 0, 1, 0, 1, 0, 1","False, False, False, False, False, False, False, True, True, False, False, False, True, True, True, True, True, True, False, False, False, False, True, True","Ff.ZagZag, Ff.Duh, Ff.WaitFreestyle, Ff.DaemonT, Ff.KoSide","VW.Laughalot, VW.Chucklesaur, VW.Snickerdoodle, VW.Gigglebot, VW.Jesterface"
8821495644,60,Immigrant Night Club #1,Pepegas,Rangoon,False,"Monkey King, Silencer, Ring Master, Rubick, Dawnbreaker, Wraith King, Arc Warden, Abaddon, Lich, Lifestealer, Nyx Assassin, Outworld Devourer, Techies, Dark Willow, Pudge, Slardar, Razor, Faceless Void, Slark, Huskar, Spectre, Invoker, Tinker, Medusa","1, 1, 0, 0, 1, 0, 0, 1, 0, 1, 1, 0, 0, 1, 1, 0, 0, 1, 1, 0, 1, 0, 1, 0","False, False, False, False, False, False, False, True, True, False, False, False, True, True, True, True, True, True, False, False, False, False, True, True","sweet winter, Second Man, Lu Yoke Mar, Demonice, Oppa Power","Tha Ye1, shwe ba,  1\/]un0 , Sirclickalot, Heinz"
8821469297,60,Dota 2 Space League,CrimsonSky,Silent killer,True,"Silencer, Pugna, Chen, Disruptor, Witch Doctor, Leshrac, Keeper of the Light, Shadow Fiend, Jakiro, Techies, Magnus, Winter Wyvern, Dark Willow, Shadow Shaman, Spirit Breaker, Slardar, Templar Assassin, Muerta, Drow Ranger, Morphling, Ursa, Naga Siren, Invoker, Luna","0, 0, 1, 1, 0, 1, 1, 0, 1, 0, 0, 1, 1, 0, 0, 1, 1, 0, 0, 1, 0, 1, 0, 1","False, False, False, False, False, False, False, True, True, False, False, False, True, True, True, True, True, True, False, False, False, False, True, True","CS.Nupiq, CS.Vexus, CS.Lemy, CS.Fijik, CS.Qipik","sK.itras, sK.yacathem, sK.busow, sK.lotorimri, sK.onenen"
8821441062,60,Dota 2 Space League,Silent killer,CrimsonSky,False,"Silencer, Shadow Demon, Visage, Windranger, Outworld Devourer, Marci, Nyx Assassin, Rubick, Crystal Maiden, Enigma, Witch Doctor, Skywrath Mage, Clockwerk, Muerta, Abaddon, Chaos Knight, Templar Assassin, Shadow Fiend, Anti-Mage, Weaver, Broodmother, Terrorblade, Dragon Knight, Sven","1, 1, 0, 0, 1, 0, 0, 1, 0, 1, 1, 0, 0, 1, 1, 0, 0, 1, 1, 0, 1, 0, 1, 0","False, False, False, False, False, False, False, True, True, False, False, False, True, True, True, True, True, True, False, False, False, False, True, True","sK.onenen, sK.itras, sK.busow, sK.lotorimri, sK.yacathem","CS.Nupiq, CS.Lemy, CS.Vexus, CS.Fijik, CS.Qipik"
8821408085,60,Dota 2 Space League,CrimsonSky,Silent killer,False,"Silencer, Pugna, Windranger, Void Spirit, Lion, Skywrath Mage, Zeus, Shadow Shaman, Disruptor, Riki, Clockwerk, Techies, Spirit Breaker, Muerta, Wraith King, Night Stalker, Sniper, Shadow Fiend, Anti-Mage, Troll Warlord, Lifestealer, Terrorblade, Sven, Razor","0, 0, 1, 1, 0, 1, 1, 0, 1, 0, 0, 1, 1, 0, 0, 1, 1, 0, 0, 1, 0, 1, 0, 1","False, False, False, False, False, False, False, True, True, False, False, False, True, True, True, True, True, True, False, False, False, False, True, True","CS.Nupiq, CS.Vexus, CS.Lemy, CS.Fijik, CS.Qipik","sK.onenen, sK.itras, sK.busow, sK.lotorimri, sK.yacathem"
8821368965,60,Dota 2 Space League,DARKNESS GAMING,HELLBEAR HEROES,True,"Io, Techies, Beastmaster, Storm Spirit, Skywrath Mage, Pangolier, Chaos Knight, Witch Doctor, Shadow Fiend, Keeper of the Light, Invoker, Queen of Pain, Hoodwink, Monkey King, Razor, Lina, Rubick, Pugna, Phantom Assassin, Death Prophet, Viper, Wraith King, Pudge, Abaddon","0, 0, 1, 1, 0, 1, 1, 0, 1, 0, 0, 1, 1, 0, 0, 1, 1, 0, 0, 1, 0, 1, 0, 1","False, False, False, False, False, False, False, True, True, False, False, False, True, True, True, True, True, True, False, False, False, False, True, True","DG.ThunderRiver, DG.Dreadlight, DG.dollymy, DG.Ndolal, DG.hoxi","HH.Rakinu, HH.Chedema, HH.Bambula, HH.packout, HH.Harbinger"
8821342421,60,DreamLeague Season 29,Tundra Esports,Aurora Gaming,False,"Muerta, Invoker, Lone Druid, Puck, Largo, Doom, Windranger, Timbersaw, Clockwerk, Storm Spirit, Bane, Zeus, Snapfire, Lion, Queen of Pain, Shadow Fiend, Lich, Tiny, Necrophos, Phoenix, Tidehunter, Venomancer, Silencer, Lycan","1, 1, 0, 0, 1, 0, 0, 1, 0, 1, 1, 0, 0, 1, 1, 0, 0, 1, 1, 0, 1, 0, 1, 0","False, False, False, False, False, False, False, True, True, False, False, False, True, True, True, True, True, True, False, False, False, False, True, True","33, Ari, Whitemon, bzm, Pure","Nightfall, Mikoto, Ws`, Mira, kaori"
8821323008,60,Dota 2 Space League,HELLBEAR HEROES,DARKNESS GAMING,False,"Abaddon, Beastmaster, Techies, Skywrath Mage, Windranger, Rubick, Shadow Demon, Crystal Maiden, Lion, Tinker, Pangolier, Treant Protector, Phoenix, Invoker, Timbersaw, Doom, Dragon Knight, Batrider, Void Spirit, Morphling, Snapfire, Sniper, Shadow Fiend, Lifestealer","0, 0, 1, 1, 0, 1, 1, 0, 1, 0, 0, 1, 1, 0, 0, 1, 1, 0, 0, 1, 0, 1, 0, 1","False, False, False, False, False, False, False, True, True, False, False, False, True, True, True, True, True, True, False, False, False, False, True, True","HH.Rakinu, HH.Chedema, HH.Bambula, HH.packout, HH.Harbinger","DG.ThunderRiver, DG.Ndolal, DG.Dreadlight, DG.dollymy, DG.hoxi"
8821285367,60,Immigrant Night Club #1,,Tee Mhr Naw,True,"Spirit Breaker, Nyx Assassin, Silencer, Night Stalker, Lycan, Lifestealer, Shadow Shaman, Lion, Rubick, Dawnbreaker, Abaddon, Warlock, Ring Master, Clockwerk, Bristleback, Enigma, Lone Druid, Windranger, Ursa, Outworld Devourer, Spectre, Death Prophet, Shadow Fiend, Tiny","1, 1, 0, 0, 1, 0, 0, 1, 0, 1, 1, 0, 0, 1, 1, 0, 0, 1, 1, 0, 1, 0, 1, 0","False, False, False, False, False, False, False, True, True, False, False, False, True, True, True, True, True, True, False, False, False, False, True, True",":), Null Reverse, asdf, shwe ba, sweet winter","a thy Tee mae SayarG(Tee Sayar), Sirclickalot, Second Man, Demonice, 92"
8821280849,60,Ultras Dota Pro League  2025-26,Eye Gaming ,Shinigami Gaming,True,"Razor, Doom, Shadow Fiend, Snapfire, Dawnbreaker, Huskar, Hoodwink, Rubick, Pangolier, Tusk, Legion Commander, Invoker, Keeper of the Light, Monkey King, Necrophos, Kez, Phoenix, Marci, Mars, Ursa, Tidehunter, Juggernaut, Alchemist, Undying","0, 0, 1, 1, 0, 1, 1, 0, 1, 0, 0, 1, 1, 0, 0, 1, 1, 0, 0, 1, 0, 1, 0, 1","False, False, False, False, False, False, False, True, True, False, False, False, True, True, True, True, True, True, False, False, False, False, True, True","red weather, so?, seven, chad, yvs","keep on dancing in the dark, modafinil, Pirate King -, meowl, TrenchWorld"
8821255705,60,DreamLeague Season 29,Aurora Gaming,Tundra Esports,True,"Puck, Tiny, Clockwerk, Lone Druid, Storm Spirit, Doom, Invoker, Largo, Timbersaw, Lion, Phoenix, Muerta, Hoodwink, Lich, Ursa, Windranger, Bane, Pangolier, Monkey King, Rubick, Ember Spirit, Shadow Demon, Dark Willow, Snapfire","1, 1, 0, 0, 1, 0, 0, 1, 0, 1, 1, 0, 0, 1, 1, 0, 0, 1, 1, 0, 1, 0, 1, 0","False, False, False, False, False, False, False, True, True, False, False, False, True, True, True, True, True, True, False, False, False, False, True, True","Nightfall, Mikoto, Ws`, Mira, kaori","33, Ari, Whitemon, bzm, Pure"
8821220450,60,Ultras Dota Pro League  2025-26,Shinigami Gaming,Eye Gaming ,False,"Shadow Fiend, Huskar, Razor, Doom, Invoker, Rubick, Dawnbreaker, Tusk, Snapfire, Pangolier, Phoenix, Bristleback, Hoodwink, Mars, Dark Willow, Necrophos, Ogre Magi, Storm Spirit, Underlord, Muerta, Tidehunter, Windranger, Drow Ranger, Anti-Mage","0, 0, 1, 1, 0, 1, 1, 0, 1, 0, 0, 1, 1, 0, 0, 1, 1, 0, 0, 1, 0, 1, 0, 1","False, False, False, False, False, False, False, True, True, False, False, False, True, True, True, True, True, True, False, False, False, False, True, True","keep on dancing in the dark, modafinil, meowl, TrenchWorld, Pirate King -","red weather, so?, yvs, seven, chad"
8821169334,60,DreamLeague Season 29,PlayTime,BB,True,"Viper, Shadow Fiend, Kez, Clockwerk, Enchantress, Snapfire, Beastmaster, Monkey King, Batrider, Doom, Pangolier, Puck, Windranger, Oracle, Rubick, Lycan, Storm Spirit, Huskar, Nyx Assassin, Dawnbreaker, Tusk, Axe, Underlord, Necrophos","1, 1, 0, 0, 1, 0, 0, 1, 0, 1, 1, 0, 0, 1, 1, 0, 0, 1, 1, 0, 1, 0, 1, 0","False, False, False, False, False, False, False, True, True, False, False, False, True, True, True, True, True, True, False, False, False, False, True, True","Wits, Elmisho, DarkMago♥, Fr△nk, Scofield","Kiritych~, gpk~, MieRo, Save-, Kataomi`"
8821116314,60,Ultras Dota Pro League  2025-26,Kiba Arms,Cinqueblinks,False,"Queen of Pain, Monkey King, Phoenix, Snapfire, Ring Master, Dawnbreaker, Huskar, Shadow Fiend, Rubick, Centaur Warrunner, Sand King, Doom, Tusk, Hoodwink, Venomancer, Ember Spirit, Mars, Visage, Faceless Void, Tiny, Morphling, Pangolier, Lifestealer, Sniper","0, 0, 1, 1, 0, 1, 1, 0, 1, 0, 0, 1, 1, 0, 0, 1, 1, 0, 0, 1, 0, 1, 0, 1","False, False, False, False, False, False, False, True, True, False, False, False, True, True, True, True, True, True, False, False, False, False, True, True","keep on dancing in the dark, скряяя, meowl, блин почему я не Роналдо, yvs","domenikosina, so?, Konina, Герман, eclipse"
8821091534,60,Destiny League,Riftwalkers,LV United,False,"Visage, Sand King, Spirit Breaker, Windranger, Void Spirit, Rubick, Nature's Prophet, Marci, Tidehunter, Silencer, Zeus, Sniper, Shadow Shaman, Snapfire, Enigma, Lion, Earth Spirit, Viper, Venomancer, Monkey King, Pangolier, Phantom Lancer, Slark, Ursa","1, 1, 0, 0, 1, 0, 0, 1, 0, 1, 1, 0, 0, 1, 1, 0, 0, 1, 1, 0, 1, 0, 1, 0","False, False, False, False, False, False, False, True, True, False, False, False, True, True, True, True, True, True, False, False, False, False, True, True","BloodStorm, VoidRift, CreepSlayer, Hellgrove, AbyssWalker","reneewilliams1915, carolynwight1917, timothydillon1990, juliettemcneil1926, meganpelc1900"
8821062142,60,Ultras Dota Pro League  2025-26,Cinqueblinks,Kiba Arms,False,"Rubick, Snapfire, Monkey King, Ring Master, Visage, Shadow Fiend, Queen of Pain, Silencer, Phoenix, Huskar, Doom, Dawnbreaker, Hoodwink, Ursa, Lion, Viper, Ember Spirit, Pangolier, Naga Siren, Centaur Warrunner, Terrorblade, Sand King, Tidehunter, Slark","0, 0, 1, 1, 0, 1, 1, 0, 1, 0, 0, 1, 1, 0, 0, 1, 1, 0, 0, 1, 0, 1, 0, 1","False, False, False, False, False, False, False, True, True, False, False, False, True, True, True, True, True, True, False, False, False, False, True, True","domenikosina, so?, Konina, Герман, eclipse","keep on dancing in the dark, блин почему я не Роналдо, meowl, yvs, скряяя"
8821039753,60,DreamLeague Season 29,PlayTime,BB,True,"Slardar, Viper, Snapfire, Clockwerk, Shadow Fiend, Kez, Puck, Beastmaster, Enchantress, Doom, Pangolier, Windranger, Hoodwink, Keeper of the Light, Bane, Monkey King, Kunkka, Storm Spirit, Lycan, Alchemist, Enigma, Lifestealer, Tiny, Underlord","1, 1, 0, 0, 1, 0, 0, 1, 0, 1, 1, 0, 0, 1, 1, 0, 0, 1, 1, 0, 1, 0, 1, 0","False, False, False, False, False, False, False, True, True, False, False, False, True, True, True, True, True, True, False, False, False, False, True, True","Wits, Elmisho, DarkMago♥, Scofield, Fr△nk","Kiritych~, gpk~, MieRo, Save-, Kataomi`"
8821032703,60,Destiny League,LV United,Riftwalkers,True,"Sniper, Pudge, Windranger, Visage, Marci, Venomancer, Pangolier, Lina, Witch Doctor, Rubick, Spirit Breaker, Void Spirit, Skywrath Mage, Zeus, Axe, Enigma, Queen of Pain, Silencer, Tiny, Sand King, Shadow Fiend, Death Prophet, Luna, Sven","1, 1, 0, 0, 1, 0, 0, 1, 0, 1, 1, 0, 0, 1, 1, 0, 0, 1, 1, 0, 1, 0, 1, 0","False, False, False, False, False, False, False, True, True, False, False, False, True, True, True, True, True, True, False, False, False, False, True, True","reneewilliams1915, carolynwight1917, timothydillon1990, juliettemcneil1926, meganpelc1900","BloodStorm, CreepSlayer, Hellgrove, VoidRift, AbyssWalker"
8820973718,60,Destiny League,LSG,Foxy gaming,True,"Nyx Assassin, Marci, Kez, Beastmaster, Death Prophet, Muerta, Lina, Queen of Pain, Skywrath Mage, Sand King, Batrider, Enigma, Rubick, Pudge, Warlock, Lich, Wraith King, Nature's Prophet, Venomancer, Silencer, Visage, Anti-Mage, Tinker, Shadow Fiend","0, 0, 1, 1, 0, 1, 1, 0, 1, 0, 0, 1, 1, 0, 0, 1, 1, 0, 0, 1, 0, 1, 0, 1","False, False, False, False, False, False, False, True, True, False, False, False, True, True, True, True, True, True, False, False, False, False, True, True","Cyrax, Nightwolf, Scorpion, Kintaro, Quan Chi","titik, Exterminator, babyface, ShinraTensei, Pudre"
8820955341,60,Ultras Dota Pro League  2025-26,Kiba Arms,Cinqueblinks,False,"Monkey King, Queen of Pain, Rubick, Snapfire, Centaur Warrunner, Phoenix, Visage, Shadow Fiend, Ring Master, Slardar, Mars, Huskar, Skywrath Mage, Tusk, Dawnbreaker, Ember Spirit, Sand King, Lion, Ursa, Faceless Void, Weaver, Luna, Tiny, Lifestealer","0, 0, 1, 1, 0, 1, 1, 0, 1, 0, 0, 1, 1, 0, 0, 1, 1, 0, 0, 1, 0, 1, 0, 1","False, False, False, False, False, False, False, True, True, False, False, False, True, True, True, True, True, True, False, False, False, False, True, True","keep on dancing in the dark, блин почему я не Роналдо, meowl, yvs, скряяя","domenikosina, eclipse, MAKJIbIM, Konina, Герман"
8820939983,60,DreamLeague Season 29,PlayTime,BB,False,"Slardar, Viper, Puck, Kez, Shadow Fiend, Clockwerk, Monkey King, Beastmaster, Hoodwink, Doom, Enchantress, Silencer, Phoenix, Keeper of the Light, Snapfire, Pangolier, Tiny, Bane, Enigma, Lifestealer, Lycan, Faceless Void, Alchemist, Dawnbreaker","1, 1, 0, 0, 1, 0, 0, 1, 0, 1, 1, 0, 0, 1, 1, 0, 0, 1, 1, 0, 1, 0, 1, 0","False, False, False, False, False, False, False, True, True, False, False, False, True, True, True, True, True, True, False, False, False, False, True, True","Wits, DarkMago♥, Scofield, Elmisho, Fr△nk","Kiritych~, gpk~, MieRo, Save-, Kataomi`"
8820925611,60,Destiny League,Foxy gaming,LSG,False,"Visage, Sand King, Batrider, Magnus, Death Prophet, Oracle, Muerta, Queen of Pain, Shadow Shaman, Venomancer, Io, Terrorblade, Vengeful Spirit, Ogre Magi, Windranger, Dragon Knight, Faceless Void, Lina, Pangolier, Anti-Mage, Marci, Drow Ranger, Phantom Assassin, Sniper","1, 1, 0, 0, 1, 0, 0, 1, 0, 1, 1, 0, 0, 1, 1, 0, 0, 1, 1, 0, 1, 0, 1, 0","False, False, False, False, False, False, False, True, True, False, False, False, True, True, True, True, True, True, False, False, False, False, True, True","titik, ShinraTensei, babyface, Pudre, Exterminator","Cyrax, Scorpion, Kintaro, Nightwolf, Quan Chi"
8820872319,60,Destiny League,LSG,Foxy gaming,False,"Tinker, Outworld Devourer, Abaddon, Beastmaster, Lone Druid, Void Spirit, Windranger, Legion Commander, Phoenix, Medusa, Meepo, Batrider, Dark Willow, Crystal Maiden, Lion, Zeus, Spirit Breaker, Lina, Naga Siren, Drow Ranger, Morphling, Faceless Void, Ursa, Monkey King","1, 1, 0, 0, 1, 0, 0, 1, 0, 1, 1, 0, 0, 1, 1, 0, 0, 1, 1, 0, 1, 0, 1, 0","False, False, False, False, False, False, False, True, True, False, False, False, True, True, True, True, True, True, False, False, False, False, True, True","Scorpion, Cyrax, Nightwolf, Kintaro, Quan Chi","babyface, titik, ShinraTensei, Pudre, Exterminator"
8820849827,60,Ultras Dota Pro League  2025-26,Elite Eclipse,Kiba Arms,True,"Huskar, Shadow Fiend, Rubick, Hoodwink, Invoker, Phoenix, Snapfire, Venomancer, Pangolier, Queen of Pain, Ember Spirit, Monkey King, Windranger, Techies, Doom, Legion Commander, Tusk, Void Spirit, Medusa, Slark, Ursa, Beastmaster, Alchemist, Luna","1, 1, 0, 0, 1, 0, 0, 1, 0, 1, 1, 0, 0, 1, 1, 0, 0, 1, 1, 0, 1, 0, 1, 0","False, False, False, False, False, False, False, True, True, False, False, False, True, True, True, True, True, True, False, False, False, False, True, True","скряяя, Гандончик, qwaza, Impact, Zatarax","keep on dancing in the dark, meowl, vogel, Оптимус В Прайме, ."
8820819206,60,Destiny League,Wiser Warriors,Lunar Vibes,True,"Outworld Devourer, Tinker, Abaddon, Beastmaster, Naga Siren, Windranger, Void Spirit, Crystal Maiden, Marci, Morphling, Medusa, Death Prophet, Rubick, Lion, Mars, Faceless Void, Doom, Shadow Fiend, Luna, Drow Ranger, Phantom Assassin, Kez, Gyrocopter, Invoker","1, 1, 0, 0, 1, 0, 0, 1, 0, 1, 1, 0, 0, 1, 1, 0, 0, 1, 1, 0, 1, 0, 1, 0","False, False, False, False, False, False, False, True, True, False, False, False, True, True, True, True, True, True, False, False, False, False, True, True","AKID, Nightfull, Dust_2, EmbraceTheLight, Sandy","LV.Duskworn, LV.Velm, LV.Ashreaver, Morne, LV.Noxen"
8820818407,60,天蝉杯,,,False,"Drow Ranger, Dark Willow, Lion, Phantom Lancer, Bounty Hunter, Shadow Shaman, Faceless Void, Rubick, Clockwerk, Night Stalker, Ancient Apparition, Spectre, Lich, Void Spirit, Jakiro, Dawnbreaker, Ember Spirit, Slark, Ursa, Beastmaster, Necrophos, Underlord, Tidehunter, Shadow Fiend","0, 0, 1, 1, 0, 1, 1, 0, 1, 0, 0, 1, 1, 0, 0, 1, 1, 0, 0, 1, 0, 1, 0, 1","False, False, False, False, False, False, False, True, True, False, False, False, True, True, True, True, True, True, False, False, False, False, True, True","游刃有余, 骤雨落宿命敲, VVA唯唯, 99, stiff3","Lvfi, <:uq, 啦啦啦, CC, 婶"
8820807165,60,刀塔扭蛋杯,12.6个悠远火星小傻蛋,汤臣一品,True,"Lina, Death Prophet, Huskar, Phoenix, Rubick, Jakiro, Lion, Drow Ranger, Hoodwink, Snapfire, Mars, Undying, Lich, Winter Wyvern, Tusk, Razor, Queen of Pain, Void Spirit, Lone Druid, Doom, Underlord, Night Stalker, Primal Beast, Faceless Void","0, 0, 1, 1, 0, 1, 1, 0, 1, 0, 0, 1, 1, 0, 0, 1, 1, 0, 0, 1, 0, 1, 0, 1","False, False, False, False, False, False, False, True, True, False, False, False, True, True, True, True, True, True, False, False, False, False, True, True","12.6, 潇洒哥, 永遠に幼き紅い月, 深藏BLUE, 悠悠非我心","Ender, 国风少女燕赤霞, MAN!!!!!!!!BRO!!!!, 24Herbs, Rain"
8820803699,60,刀塔扭蛋杯,兄弟DOTA,九州忠诚,False,"Grimstroke, Clockwerk, Dawnbreaker, Night Stalker, Monkey King, Doom, Faceless Void, Techies, Mars, Lone Druid, Snapfire, Centaur Warrunner, Drow Ranger, Bristleback, Lion, Lich, Skywrath Mage, Ember Spirit, Necrophos, Luna, Huskar, Lifestealer, Dragon Knight, Slark","1, 1, 0, 0, 1, 0, 0, 1, 0, 1, 1, 0, 0, 1, 1, 0, 0, 1, 1, 0, 1, 0, 1, 0","False, False, False, False, False, False, False, True, True, False, False, False, True, True, True, True, True, True, False, False, False, False, True, True","5ZN.郭嘉-, Griffin, Hunter100%, 6, YingCheng","很难不suki嘉然小姐, 等有机会的, 0.0, 我将以波浪形态出击, 30fps 200ping"
8820793201,60,Ultras Dota Pro League  2025-26,Kiba Arms,Elite Eclipse,False,"Centaur Warrunner, Rubick, Huskar, Shadow Fiend, Timbersaw, Snapfire, Invoker, Hoodwink, Venomancer, Windranger, Mars, Bristleback, Tusk, Phoenix, Doom, Brewmaster, Dawnbreaker, Faceless Void, Earthshaker, Storm Spirit, Puck, Queen of Pain, Ember Spirit, Pangolier","1, 1, 0, 0, 1, 0, 0, 1, 0, 1, 1, 0, 0, 1, 1, 0, 0, 1, 1, 0, 1, 0, 1, 0","False, False, False, False, False, False, False, True, True, False, False, False, True, True, True, True, True, True, False, False, False, False, True, True","keep on dancing in the dark, vogel, meowl, Оптимус В Прайме, .","Гандончик, Impact, qwaza, скряяя, Zatarax"
8820793189,60,刀塔扭蛋杯,我很强,法式可颂蛋挞,True,"Lone Druid, Lion, Doom, Hoodwink, Lich, Rubick, Phoenix, Ring Master, Snapfire, Tidehunter, Night Stalker, Puck, Shadow Shaman, Pudge, Beastmaster, Dawnbreaker, Faceless Void, Silencer, Storm Spirit, Queen of Pain, Ember Spirit, Kez, Sand King, Leshrac","0, 0, 1, 1, 0, 1, 1, 0, 1, 0, 0, 1, 1, 0, 0, 1, 1, 0, 0, 1, 0, 1, 0, 1","False, False, False, False, False, False, False, True, True, False, False, False, True, True, True, True, True, True, False, False, False, False, True, True","我来监督沙瑞金, Nothingtosay, 新宇宙, Xxs.Collapse.责任神, ◢◤Avicii打不赢纱雾","horizon, Misaka Mikoto, 两豪杰四张狂, 柠檬茶, Q"
8820791846,60,DreamLeague Season 29,Xtreme Gaming,Tundra Esports,False,"Muerta, Invoker, Clockwerk, Lone Druid, Kez, Tinker, Drow Ranger, Phoenix, Lich, Timbersaw, Largo, Nyx Assassin, Puck, Lion, Pangolier, Doom, Hoodwink, Terrorblade, Faceless Void, Centaur Warrunner, Lifestealer, Lycan, Axe, Necrophos","0, 0, 1, 1, 0, 1, 1, 0, 1, 0, 0, 1, 1, 0, 0, 1, 1, 0, 0, 1, 0, 1, 0, 1","False, False, False, False, False, False, False, True, True, False, False, False, True, True, True, True, True, True, False, False, False, False, True, True","Ame, NothingToSay, Xxs, fy, xNova","33, Ari, Whitemon, bzm, Pure"
8820786100,60,刀塔扭蛋杯,毒爆虫孵化池,蛋仔派对,False,"Alchemist, Invoker, Lone Druid, Lion, Lifestealer, Disruptor, Primal Beast, Snapfire, Hoodwink, Drow Ranger, Axe, Faceless Void, Ring Master, Lich, Night Stalker, Weaver, Slardar, Muerta, Pangolier, Puck, Huskar, Queen of Pain, Void Spirit, Lina","0, 0, 1, 1, 0, 1, 1, 0, 1, 0, 0, 1, 1, 0, 0, 1, 1, 0, 0, 1, 0, 1, 0, 1","False, False, False, False, False, False, False, True, True, False, False, False, True, True, True, True, True, True, False, False, False, False, True, True","乃龙, ggx, 间桐樱, Play your own, Echo","白桃乌龙, Primate Reaper, 幺鸡麻将王, 卍解, 伯纳乌杀神"
8820769828,60,Destiny League,Lunar Vibes,Wiser Warriors,False,"Abaddon, Shadow Fiend, Void Spirit, Windranger, Kez, Visage, Pangolier, Venomancer, Zeus, Lich, Ember Spirit, Nyx Assassin, Batrider, Alchemist, Legion Commander, Tidehunter, Rubick, Tiny, Broodmother, Skywrath Mage, Meepo, Winter Wyvern, Monkey King, Luna","1, 1, 0, 0, 1, 0, 0, 1, 0, 1, 1, 0, 0, 1, 1, 0, 0, 1, 1, 0, 1, 0, 1, 0","False, False, False, False, False, False, False, True, True, False, False, False, True, True, True, True, True, True, False, False, False, False, True, True","Morne, LV.Velm, LV.Ashreaver, LV.Duskworn, LV.Noxen","AKID, Nightfull, EmbraceTheLight, Dust_2, Sandy"
8820741060,60,Ultras Dota Pro League  2025-26,Ghost Sheep,Nethercore,True,"Phoenix, Doom, Lone Druid, Shadow Fiend, Pangolier, Invoker, Huskar, Snapfire, Rubick, Sniper, Lion, Ember Spirit, Tusk, Hoodwink, Spirit Breaker, Dawnbreaker, Storm Spirit, Visage, Naga Siren, Clinkz, Medusa, Weaver, Troll Warlord, Faceless Void","0, 0, 1, 1, 0, 1, 1, 0, 1, 0, 0, 1, 1, 0, 0, 1, 1, 0, 0, 1, 0, 1, 0, 1","False, False, False, False, False, False, False, True, True, False, False, False, True, True, True, True, True, True, False, False, False, False, True, True","Keyleth, qwaza, потрошиловка, yvs, .","блин почему я не Роналдо, Impact, Weak on pussy, TrenchWorld, скряяя"
